{"algorithm_version":1,"attachments":[],"cliffs":{"levels":[0,0,0,0,0,0,0,0,0,0,0,0,0,0,0,0,0,0,0,0,0,0,0,0,0,0,0,0,0,0,0,0,0,0,0,0,0,0,0,0,0,0,0,0,0,0,0,0,0,0,0,0,0,0,0,0,0,0,0,0,0,0,0,0],"ramps":[],"style_id":"cliff_crimsdale_stone"},"environment":{"ambient_color_linear":[0.25,0.3,0.35],"ambient_energy":0.8,"fog_color_linear":[0.35,0.4,0.45],"fog_density":0.01,"fog_enabled":true,"fog_end_m":120.0,"fog_start_m":20.0,"sky_id":"sky_crimsdale_day","sun_azimuth_deg":35.0,"sun_color_linear":[1.0,0.86,0.68],"sun_elevation_deg":52.0,"sun_energy":1.35},"grid":{"cell_size_m":1.0,"depth_cells":8,"heights_cm":[0,0,0,0,0,0,0,0,0,0,0,0,0,0,0,0,0,0,0,0,0,0,0,0,0,0,0,0,0,0,0,0,0,0,0,0,0,0,0,0,100,100,100,0,0,0,0,0,0,0,0,0,0,0,0,0,0,0,0,0,0,0,0,0,0,0,0,0,0,0,0,0,0,0,0,0,0,0,0,0,0],"origin_x_m":-4.0,"origin_z_m":-4.0,"width_cells":8},"pathing":{"movement":["inherit","inherit","inherit","inherit","inherit","inherit","inherit","inherit","inherit","inherit","inherit","inherit","inherit","inherit","inherit","inherit","inherit","inherit","inherit","blocked","blocked","inherit","inherit","inherit","inherit","inherit","inherit","inherit","inherit","inherit","inherit","inherit","inherit","inherit","inherit","inherit","inherit","inherit","inherit","inherit","inherit","inherit","inherit","inherit","inherit","inherit","inherit","inherit","inherit","inherit","inherit","inherit","inherit","inherit","inherit","inherit","inherit","inherit","inherit","inherit","inherit","inherit","inherit","inherit"],"placement":["inherit","inherit","inherit","inherit","inherit","inherit","inherit","inherit","inherit","inherit","inherit","inherit","inherit","inherit","inherit","inherit","inherit","inherit","inherit","inherit","inherit","inherit","inherit","inherit","inherit","inherit","inherit","blocked","inherit","inherit","inherit","inherit","inherit","inherit","inherit","inherit","inherit","inherit","inherit","inherit","inherit","inherit","inherit","inherit","inherit","inherit","inherit","inherit","inherit","inherit","inherit","inherit","inherit","inherit","inherit","inherit","inherit","inherit","inherit","inherit","inherit","inherit","inherit","inherit"]},"surfaces":{"layer_ids":["surface_crimsdale_grass","surface_crimsdale_dirt"],"weights":[255,0,255,0,255,0,255,0,255,0,255,0,255,0,255,0,255,0,255,0,255,0,255,0,255,0,255,0,255,0,255,0,255,0,255,0,128,127,128,127,255,0,255,0,255,0,255,0,255,0,255,0,128,127,128,127,255,0,255,0,255,0,255,0,255,0,255,0,255,0,255,0,255,0,255,0,255,0,255,0,255,0,255,0,255,0,255,0,255,0,255,0,255,0,255,0,255,0,255,0,255,0,255,0,255,0,255,0,255,0,255,0,255,0,255,0,255,0,255,0,255,0,255,0,255,0,255,0]},"terrain_format_version":1,"water":{"enabled":true,"level_cm":25}}
